{
  "$schema": "https://json-schema.org/draft/2020-12/schema",
  "title": "Excalidraw theme tokens",
  "type": "object",
  "additionalProperties": false,
  "required": ["name", "mode", "description", "canvas", "ink", "accent", "palette", "grid", "type", "stroke", "pen", "surface", "frame"],
  "properties": {
    "$schema": {
      "type": "string"
    },
    "name": {
      "type": "string",
      "minLength": 1
    },
    "mode": {
      "enum": ["light", "dark"]
    },
    "description": {
      "type": "string"
    },
    "canvas": {
      "type": "string",
      "pattern": "^#[0-9a-fA-F]{6}$"
    },
    "ink": {
      "type": "string",
      "pattern": "^#[0-9a-fA-F]{6}$"
    },
    "accent": {
      "type": "string",
      "pattern": "^#[0-9a-fA-F]{6}$"
    },
    "palette": {
      "type": "array",
      "items": {
        "type": "string",
        "pattern": "^#[0-9a-fA-F]{6}$"
      },
      "minItems": 4,
      "maxItems": 12
    },
    "washes": {
      "type": "array",
      "items": {
        "type": "integer",
        "minimum": 0
      },
      "minItems": 4,
      "maxItems": 4
    },
    "grid": {
      "type": "object",
      "additionalProperties": false,
      "required": ["color", "minor", "major", "style"],
      "properties": {
        "color": {
          "type": "string",
          "pattern": "^#[0-9a-fA-F]{6}$"
        },
        "minor": {
          "type": "number",
          "minimum": 0,
          "maximum": 1
        },
        "major": {
          "type": "number",
          "minimum": 0,
          "maximum": 1
        },
        "style": {
          "enum": ["solid", "dashed"]
        }
      }
    },
    "type": {
      "type": "object",
      "additionalProperties": false,
      "required": ["ui", "canvas", "size"],
      "properties": {
        "ui": {
          "type": "string"
        },
        "canvas": {
          "enum": ["Excalifont", "Virgil", "Nunito", "Lilita One", "Comic Shanns", "Liberation Sans", "Cascadia", "Assistant", "Helvetica"]
        },
        "size": {
          "type": "number",
          "exclusiveMinimum": 0
        }
      }
    },
    "stroke": {
      "type": "object",
      "additionalProperties": false,
      "required": ["width", "roughness", "roundness", "arrowhead", "arrowType", "fill"],
      "properties": {
        "width": {
          "enum": ["thin", "medium", "bold"]
        },
        "roughness": {
          "enum": [0, 1, 2]
        },
        "roundness": {
          "enum": ["sharp", "round"]
        },
        "arrowhead": {
          "enum": ["arrow", "bar", "circle", "circle_outline", "triangle", "triangle_outline", "diamond", "diamond_outline"]
        },
        "arrowType": {
          "enum": ["sharp", "round"]
        },
        "fill": {
          "enum": ["solid", "hachure", "cross-hatch", "zigzag"]
        }
      }
    },
    "pen": {
      "type": "object",
      "additionalProperties": false,
      "required": ["pressure", "width"],
      "properties": {
        "pressure": {
          "type": "boolean"
        },
        "width": {
          "type": "number",
          "exclusiveMinimum": 0,
          "maximum": 4
        },
        "thinning": {
          "type": "number",
          "minimum": -1,
          "maximum": 1
        },
        "taper": {
          "type": "number",
          "minimum": 0
        },
        "streamline": {
          "type": "number",
          "minimum": 0,
          "maximum": 1
        }
      }
    },
    "surface": {
      "type": "object",
      "additionalProperties": false,
      "required": ["radius", "border", "shadow"],
      "properties": {
        "radius": {
          "type": "number",
          "minimum": 0
        },
        "border": {
          "enum": ["none", "hairline", "bold"]
        },
        "shadow": {
          "enum": ["none", "soft", "long", "hard"]
        },
        "panel": {
          "type": "string",
          "pattern": "^#[0-9a-fA-F]{6}$"
        },
        "active": {
          "type": "string",
          "pattern": "^#[0-9a-fA-F]{6}$"
        }
      }
    },
    "frame": {
      "type": "object",
      "additionalProperties": false,
      "required": ["width", "alpha"],
      "properties": {
        "width": {
          "type": "number",
          "exclusiveMinimum": 0
        },
        "alpha": {
          "type": "number",
          "minimum": 0,
          "maximum": 1
        }
      }
    },
    "backdrop": {
      "type": "string"
    },
    "extra": {
      "type": "string"
    }
  }
}
