{
  "name": "Westworld Night",
  "mode": "dark",
  "description": "White-on-black stencil: deep graphite ground, a barely-there grid, hairline bone ink, bronze for anything live. Machined, unhurried.",
  "canvas": "#0b0c0e",
  "ink": "#ece8e0",
  "accent": "#c89a5a",
  "palette": ["#c89a5a", "#b0574e", "#8fa6b8", "#93a897", "#a58fb0", "#d8c27a", "#c98559", "#45464c", "#5a5b61"],
  "washes": [0, 7, 8, 2],
  "grid": { "color": "#f0eee8", "minor": 0.045, "major": 0.11, "style": "solid" },
  "type": { "ui": "Liberation Sans", "canvas": "Liberation Sans", "size": 15 },
  "stroke": { "width": "thin", "roughness": 0, "roundness": "sharp", "arrowhead": "arrow", "arrowType": "sharp", "fill": "solid" },
  "pen": { "pressure": true, "width": 0.2, "thinning": 0.25, "taper": 5 },
  "surface": { "radius": 0, "border": "hairline", "shadow": "none", "panel": "#121316" },
  "frame": { "width": 1, "alpha": 0.55 },
  "extra": ":scope .selected-shape-actions h3,\n:scope .selected-shape-actions legend,\n:scope .frame-breadcrumb {\n  letter-spacing: 0.14em;\n  text-transform: uppercase;\n  font-size: 0.6875rem;\n}\n\n:scope .frame-breadcrumb {\n  border-radius: 0;\n  background: transparent;\n  box-shadow: none;\n}"
}
